{
  "version": 1,
  "doc_id": "Software-maintenance_-service-level-agreement",
  "doc_format": "docx",
  "source_filename": "Software maintenance_ service level agreement.docx",
  "char_count": 15670,
  "block_count": 112,
  "section_count": 85,
  "ltu_count": 112,
  "max_section_depth": 4,
  "has_tag_ranges": true,
  "schema_version": "1.0.0",
  "filemap": {
    "blocks": "blocks.jsonl",
    "sections": "sections.json",
    "styles": "styles.json",
    "tag_ranges": "tag_ranges.jsonl"
  }
}
