{
  "version": 1,
  "doc_id": "Sample-Completed-Hosting-Agreement-2025",
  "doc_format": "docx",
  "source_filename": "Sample Completed Hosting Agreement 2025.docx",
  "char_count": 48283,
  "block_count": 323,
  "section_count": 56,
  "ltu_count": 323,
  "max_section_depth": 3,
  "has_tag_ranges": true,
  "schema_version": "1.0.0",
  "filemap": {
    "blocks": "blocks.jsonl",
    "sections": "sections.json",
    "styles": "styles.json",
    "tag_ranges": "tag_ranges.jsonl"
  }
}
