{
  "version": 1,
  "doc_id": "123e4567-e89b-12d3-a456-426614174000",
  "doc_format": "docx",
  "source_filename": "SOW Elavon Sept 25 - DRAFT PO V1 - HJ4-fixed7-BEFORE.docx",
  "char_count": 22327,
  "block_count": 299,
  "section_count": 112,
  "ltu_count": 299,
  "max_section_depth": 3,
  "has_tag_ranges": true,
  "schema_version": "1.0.0",
  "filemap": {
    "blocks": "blocks.jsonl",
    "sections": "sections.json",
    "styles": "styles.json",
    "tag_ranges": "tag_ranges.jsonl"
  }
}
