{
  "version": 1,
  "doc_id": "Equipment-maintenance-agreement",
  "doc_format": "docx",
  "source_filename": "Equipment maintenance agreement.docx",
  "char_count": 47672,
  "block_count": 324,
  "section_count": 300,
  "ltu_count": 324,
  "max_section_depth": 4,
  "has_tag_ranges": true,
  "schema_version": "1.0.0",
  "filemap": {
    "blocks": "blocks.jsonl",
    "sections": "sections.json",
    "styles": "styles.json",
    "tag_ranges": "tag_ranges.jsonl"
  }
}
