{
  "version": 1,
  "doc_id": "123e4567-e89b-12d3-a456-426614174000",
  "doc_format": "docx",
  "source_filename": "Lamplight_Hosting_Agreement.docx",
  "char_count": 48481,
  "block_count": 282,
  "section_count": 43,
  "ltu_count": 282,
  "max_section_depth": 2,
  "has_tag_ranges": true,
  "schema_version": "1.0.0",
  "filemap": {
    "blocks": "blocks.jsonl",
    "sections": "sections.json",
    "styles": "styles.json",
    "tag_ranges": "tag_ranges.jsonl"
  }
}
