{
  "version": 1,
  "doc_id": "DRAFTING-NOTES-FOR-Hardware-maintenance-agreement.",
  "doc_format": "docx",
  "source_filename": "DRAFTING NOTES FOR Hardware maintenance agreement.doc.docx",
  "char_count": 81299,
  "block_count": 357,
  "section_count": 30,
  "ltu_count": 357,
  "max_section_depth": 1,
  "has_tag_ranges": true,
  "schema_version": "1.0.0",
  "filemap": {
    "blocks": "blocks.jsonl",
    "sections": "sections.json",
    "styles": "styles.json",
    "tag_ranges": "tag_ranges.jsonl"
  }
}
