{
  "version": 1,
  "doc_id": "One2call---General-Terms-Conditions---Milewood-V1",
  "doc_format": "docx",
  "source_filename": "One2call - General Terms Conditions - Milewood V1.docx",
  "char_count": 96923,
  "block_count": 477,
  "section_count": 1,
  "ltu_count": 477,
  "max_section_depth": 1,
  "has_tag_ranges": true,
  "schema_version": "1.0.0",
  "filemap": {
    "blocks": "blocks.jsonl",
    "sections": "sections.json",
    "styles": "styles.json",
    "tag_ranges": "tag_ranges.jsonl"
  }
}
